{
  "schema_version": "1.0.0",
  "writing_id": "home-writing-001",
  "draft_id": "home-draft-001",
  "revision": 1,
  "task_id": "home-task-001",
  "note_type": "search",
  "keyword_plan_ref": "home-keyword-plan-001",
  "title": "小户型玄关收纳：不用添置新家具，先试这三步",
  "body": "小户型玄关收纳，不一定要先买新的收纳家具。先观察每天带进带出的物品，再按使用频率安排位置。\n\n第一步，把鞋、包、钥匙等物品分开看：哪些每天用，哪些只是偶尔用。先处理最常出现的一类，不必一次整理整个家。\n\n第二步，为高频物品划出一个固定、顺手的位置。可以利用已有的托盘、挂钩或柜内空格；是否适合要看实际尺寸和租住条件。\n\n第三步，给临时物品留一个小区域，回家后再按用途归位。这个玄关收纳方法强调方便维护，不承诺空间变大或永远不乱。\n\n如果入口很窄，优先保证通行安全，不要把物品放在门扇、消防通道或容易绊倒的位置。\n\n这是合成演示稿，不含真实用户案例或产品推荐。你可以先从每天最常找不到的一件物品开始。",
  "topics": [
    "#小户型收纳",
    "#玄关整理",
    "#玄关收纳方法"
  ],
  "pinned_comment": "你最常在玄关找不到什么？（合成示例互动句）",
  "secondary_comment": null,
  "keyword_usage_report": [
    {
      "keyword_id": "home-kw-01",
      "phrase": "小户型玄关收纳",
      "found": true,
      "placements": [
        "title",
        "body",
        "topic"
      ]
    },
    {
      "keyword_id": "home-kw-02",
      "phrase": "玄关收纳方法",
      "found": true,
      "placements": [
        "body",
        "tag"
      ]
    }
  ],
  "warnings": [
    "Synthetic content only; verify dimensions, safety, and local requirements for real use."
  ],
  "status": "draft",
  "synthetic": true
}
