{
  "schema_version": "1.0.0",
  "writing_id": "FR-HERB-W-001",
  "draft_id": "FR-HERB-D-001",
  "revision": 1,
  "task_id": "FR-HERB-001",
  "note_type": "search",
  "keyword_plan_ref": "FR-HERB-KW-001",
  "title": "窗台香草种植怎么开始？买苗前先记下这三件事",
  "body": "准备在窗台种香草时，先别急着根据一张图片挑品种。不同房间的朝向、遮挡和季节都不一样，先把自己的位置观察清楚，之后查具体品种要求会更有依据。香草种植新手可以从描述环境开始，而不是先猜哪种植物一定适合。\n\n第一件事，选几个固定时段看窗边：早上、接近中午、下午各观察一次，记下有没有直射光、光线是否被楼体或窗帘挡住。这个窗台光照观察不是在测精确日照时长，只是比较一天里光线变化。\n\n第二件事，记一下窗台的朝向和附近遮挡。若不确定朝向，可以先用地图或指南针辅助确认；不需要为了这一步购买设备。\n\n第三件事，连续几天用同一张小表记录。天气不同会影响观察，所以把阴天、晴天分开注明。记录只能帮助你描述自家环境，不能单独判断某种植物一定能不能长好。\n\n之后再查准备种的具体香草对光照、温度和容器的要求；若资料不确定，可以先少量尝试并继续观察。窗台香草种植没有适用于每个房间的统一答案，先了解位置条件，比直接照搬别人的摆放方式更稳妥。\n\n你也可以把自己的观察记成“上午有直射光 / 下午被遮挡”这类描述，再用来查资料。",
  "topics": [
    "#窗台种植",
    "#香草种植",
    "#新手种植"
  ],
  "pinned_comment": "你家窗台的光线大多出现在上午还是下午？可以先观察几天再判断。",
  "secondary_comment": null,
  "keyword_usage_report": [
    {
      "keyword_id": "kw-herb-01",
      "phrase": "窗台香草种植",
      "found": true,
      "placements": [
        "title",
        "body",
        "topic"
      ]
    },
    {
      "keyword_id": "kw-herb-02",
      "phrase": "窗台光照观察",
      "found": true,
      "placements": [
        "body",
        "tag"
      ]
    },
    {
      "keyword_id": "kw-herb-03",
      "phrase": "香草种植新手",
      "found": true,
      "placements": [
        "body",
        "topic"
      ]
    }
  ],
  "warnings": [
    "一般性观察建议；具体品种需求需查阅可信园艺资料。未提供实时平台趋势或搜索数据。"
  ],
  "status": "draft",
  "synthetic": true
}